{
  "value": "Exploration Vs Exploitation",
  "use_when": [
    "the user must decide how much to spend learning new opportunities versus scaling known ones",
    "resource allocation between search and execution is central"
  ],
  "research_behavior": [
    "estimate value of information",
    "identify learning curves and knowledge compounding",
    "ask when to stop exploring and when to scale",
    "measure learning velocity, not just immediate payoff"
  ],
  "key_questions": [
    "What uncertainty can be reduced cheaply?",
    "What knowledge compounds across future decisions?",
    "When is exploration no longer worth it?",
    "What must be true to switch from explore to exploit?",
    "Where are we underexploring or overexploiting?"
  ],
  "action_logic": [
    "optimize learning-adjusted return, not just immediate return",
    "balance option creation against dilution of focus"
  ],
  "monitoring_style": [
    "funnel progression and learning-rate based"
  ],
  "failure_mode": [
    "permanent exploration or premature scaling"
  ],
  "stage_guidance": {
    "routing": {
      "importance": "Important",
      "guidance": "Classifies the action problem as a learning-versus-scaling allocation tradeoff."
    },
    "boundary": {
      "importance": "Light",
      "guidance": "Pulls in value of information, learning loops, and resource-allocation tradeoffs."
    },
    "structure": {
      "importance": "Moderate",
      "guidance": "Adds search funnels, learning curves, and compounding knowledge structure."
    },
    "scenarios": {
      "importance": "Important",
      "guidance": "Favors branches tied to continue exploring, begin scaling, or stop exploring."
    },
    "question_generation": {
      "importance": "Important",
      "guidance": "Favors questions about cheap uncertainty reduction, knowledge compounding, and switch conditions."
    },
    "evidence_planning": {
      "importance": "Moderate",
      "guidance": "Ties evidence timing to when exploration should stop and exploitation should begin."
    },
    "decision_logic": {
      "importance": "Important",
      "guidance": "Core stage: must define explore/scale split, switch criteria, and resource discipline."
    },
    "signal_translation": {
      "importance": "Important",
      "guidance": "Signals should indicate learning velocity, funnel progression, and diminishing value of exploration."
    },
    "monitoring": {
      "importance": "Important",
      "guidance": "Monitoring should track whether learning is still compounding or whether scaling is overdue."
    },
    "render": {
      "importance": "Moderate",
      "guidance": "Outputs should make the exploration/exploitation tradeoff explicit."
    }
  }
}
